{
  "$schema": "https://json-schema.org/draft/2020-12/schema",
  "$id": "https://nimblesite.dev/schemas/shipwright/v1.json",
  "title": "Nimblesite Shipwright product manifest",
  "description": "Authoritative per-product manifest declaring components, bundling, version contracts, and host policies. Lives at repo root of every product as `shipwright.json`.",
  "type": "object",
  "required": ["manifestVersion", "product", "components"],
  "additionalProperties": false,
  "properties": {
    "manifestVersion": {
      "type": "integer",
      "const": 1,
      "description": "Schema version. Increment on breaking changes."
    },
    "product": {
      "type": "object",
      "required": ["id", "version"],
      "additionalProperties": false,
      "properties": {
        "id": {
          "type": "string",
          "pattern": "^[a-z0-9][a-z0-9-]{1,63}$",
          "description": "Stable product identifier. kebab-case."
        },
        "displayName": { "type": "string" },
        "version": {
          "type": "string",
          "description": "The expected product version this manifest targets. Stamped from tag at release time.",
          "pattern": "^[0-9]+\\.[0-9]+\\.[0-9]+(?:-[0-9A-Za-z.-]+)?(?:\\+[0-9A-Za-z.-]+)?$"
        },
        "repository": { "type": "string", "format": "uri" },
        "homepage": { "type": "string", "format": "uri" }
      }
    },
    "components": {
      "type": "array",
      "minItems": 1,
      "description": "Every deployable unit of the product: CLIs, LSPs, MCPs, sidecars, IDE extensions, assets.",
      "items": { "$ref": "#/$defs/component" }
    },
    "hosts": {
      "type": "object",
      "description": "Per-host policy bundle. A host that is absent is unsupported by the product.",
      "additionalProperties": false,
      "properties": {
        "vscode": { "$ref": "#/$defs/hostPolicy" },
        "jetbrains": { "$ref": "#/$defs/hostPolicy" },
        "zed": { "$ref": "#/$defs/hostPolicy" },
        "cli": { "$ref": "#/$defs/hostPolicy" },
        "pkgmgr": { "$ref": "#/$defs/hostPolicy" }
      }
    },
    "supplyChain": {
      "type": "object",
      "additionalProperties": false,
      "description": "Portfolio supply-chain controls this product enforces in its build, distribution, and host-resolution paths. Absent = inherit the Shipwright secure-by-default controls (see docs/specs/supply-chain-security.md [SWR-SEC-*]).",
      "properties": {
        "slsaBuildLevel": {
          "type": "integer",
          "enum": [2],
          "default": 2,
          "description": "[SWR-SEC-PROVENANCE] Required SLSA v1.0 Build Level. Only L2 is claimable on GitHub-hosted runners (Artifact Attestations); L3 (run isolation + inaccessible signing material) is NOT achievable there and MUST NOT be claimed."
        },
        "provenance": {
          "type": "boolean",
          "default": true,
          "description": "[SWR-SEC-PROVENANCE] Require a signed build-provenance attestation for every released artifact and published package."
        },
        "sbom": {
          "type": "string",
          "enum": ["cyclonedx", "spdx", "none"],
          "default": "cyclonedx",
          "description": "[SWR-SEC-SBOM] SBOM format attested per artifact."
        },
        "signedChecksums": {
          "type": "boolean",
          "default": true,
          "description": "[SWR-SEC-CHECKSUM] Releases publish a cosign-signed SHA256SUMS; the host verifies digest AND identity-pinned signature before exec."
        },
        "frozenInstall": {
          "type": "boolean",
          "default": true,
          "description": "[SWR-SEC-FROZEN-INSTALL] CI/release installs are lockfile-frozen (npm ci / pnpm --frozen-lockfile / cargo --locked)."
        },
        "pinnedActions": {
          "type": "boolean",
          "default": true,
          "description": "[SWR-SEC-ACTION-PINNING] Every `uses:` and reusable-workflow ref is a full 40-char commit SHA."
        },
        "oidcPublish": {
          "type": "boolean",
          "default": true,
          "description": "[SWR-SEC-OIDC-PUBLISH] Registry publishing uses OIDC trusted publishing with no long-lived token; the VSIX Marketplace PAT runs inside a protected environment."
        },
        "vulnGate": {
          "type": "string",
          "enum": ["critical", "high", "off"],
          "default": "high",
          "description": "[SWR-SEC-VULN-GATE] Severity at which the dependency-vulnerability gate fails the build."
        }
      }
    }
  },
  "$defs": {
    "component": {
      "type": "object",
      "required": ["id", "kind"],
      "additionalProperties": false,
      "properties": {
        "id": {
          "type": "string",
          "pattern": "^[a-z0-9][a-z0-9-]{1,63}$",
          "description": "Component id, unique within the product."
        },
        "kind": {
          "type": "string",
          "enum": [
            "cli",
            "lsp",
            "mcp",
            "sidecar",
            "dap",
            "tool",
            "extension-vscode",
            "extension-jetbrains",
            "extension-zed",
            "asset"
          ]
        },
        "language": {
          "type": "string",
          "enum": ["rust", "dotnet", "dart", "typescript", "kotlin", "javascript"]
        },
        "binaryName": {
          "type": "string",
          "description": "argv[0] of the binary or npm bin / dotnet tool command."
        },
        "expectedVersion": {
          "type": "string",
          "description": "semver string or ${PRODUCT_VERSION}. When set, host must verify this value against binary --version output."
        },
        "platforms": {
          "type": "array",
          "items": {
            "type": "string",
            "enum": ["darwin-arm64", "darwin-x64", "linux-x64", "linux-arm64", "win32-x64", "win32-arm64", "all"]
          },
          "description": "Platforms this component ships for. `all` means platform-agnostic (Node, dotnet tool, jar)."
        },
        "bundled": {
          "type": "object",
          "description": "If set, this component is bundled inside an IDE extension artifact.",
          "required": ["bundlePath"],
          "additionalProperties": false,
          "properties": {
            "bundlePath": {
              "type": "string",
              "description": "Path template relative to extension root, e.g. `bin/${platform}/${binaryName}${exe}`."
            },
            "perPlatformArtifact": {
              "type": "boolean",
              "default": true,
              "description": "True = one artifact per platform (VSIX --target). False = single fat artifact."
            },
            "checksum": {
              "type": "boolean",
              "default": true,
              "description": "SWR-VSIX-BUNDLE-VERIFY: verify the staged binary's SHA-256 against the signed release SHA256SUMS before `vsce package`, and have the host re-verify the bundled binary at activation."
            }
          }
        },
        "sources": {
          "type": "array",
          "description": "Ordered discovery chain the host must follow. Earlier = higher priority.",
          "items": {
            "type": "string",
            "enum": [
              "user-setting",
              "env",
              "path",
              "bundled",
              "pkgmgr",
              "dotnet-tool",
              "npm-global",
              "cargo-bin",
              "github-release",
              "lsp-initialize"
            ]
          },
          "uniqueItems": true
        },
        "userSetting": {
          "type": "string",
          "description": "IDE settings key (e.g. `deslop.binaryPath`)."
        },
        "env": {
          "type": "object",
          "additionalProperties": false,
          "properties": {
            "pathVar": { "type": "string", "description": "e.g. DESLOP_BINARY_PATH" },
            "dirVar": { "type": "string", "description": "e.g. DESLOP_BINARY_DIR" }
          }
        },
        "pkgmgr": {
          "type": "object",
          "additionalProperties": false,
          "properties": {
            "brew": { "type": "string" },
            "scoop": { "type": "string" },
            "apt": { "type": "string" },
            "winget": { "type": "string" }
          }
        },
        "dotnetTool": {
          "type": "object",
          "required": ["package"],
          "additionalProperties": false,
          "properties": {
            "package": { "type": "string" },
            "command": { "type": "string" }
          }
        },
        "npm": {
          "type": "object",
          "additionalProperties": false,
          "properties": {
            "package": { "type": "string" },
            "bin": { "type": "string" }
          }
        },
        "githubRelease": {
          "type": "object",
          "additionalProperties": false,
          "description": "GitHub Release source plus the integrity contract the host MUST honor before executing a downloaded asset. See [SWR-SEC-CHECKSUM] / [SWR-SEC-PROVENANCE] / [SWR-SEC-SBOM] in docs/specs/supply-chain-security.md.",
          "properties": {
            "repo": { "type": "string", "pattern": "^[^/]+/[^/]+$" },
            "assetPattern": { "type": "string", "description": "e.g. `basilisk-${version}-${platform}.tar.gz`" },
            "checksum": {
              "type": "boolean",
              "default": true,
              "description": "SWR-SEC-CHECKSUM: host recomputes SHA-256 and matches the published SHA256SUMS before exec."
            },
            "signature": {
              "type": "string",
              "enum": ["cosign", "none"],
              "default": "cosign",
              "description": "SWR-SEC-CHECKSUM: signature scheme over SHA256SUMS. `cosign` = keyless Sigstore (Fulcio cert + Rekor log); host runs an identity-pinned `cosign verify-blob`, never --insecure-ignore-tlog."
            },
            "signerWorkflow": {
              "type": "string",
              "description": "SWR-SEC-CHECKSUM/PROVENANCE: expected signing workflow ref, e.g. `Nimblesite/Deslop/.github/workflows/release.yml`. Host pins the certificate identity / `gh attestation verify --signer-workflow` to this, so a token stolen in another repo cannot forge a passing release."
            },
            "provenance": {
              "type": "boolean",
              "default": true,
              "description": "SWR-SEC-PROVENANCE: a signed SLSA build provenance attestation accompanies the asset; host runs `gh attestation verify` and fails closed before exec."
            },
            "sbom": {
              "type": "boolean",
              "default": true,
              "description": "SWR-SEC-SBOM: an attested CycloneDX SBOM accompanies the asset."
            },
            "predicateType": {
              "type": "string",
              "default": "https://cyclonedx.org/bom",
              "description": "SWR-SEC-SBOM: predicate type the host asserts when verifying the SBOM attestation."
            }
          }
        },
        "verifyStartup": {
          "type": "boolean",
          "default": true,
          "description": "Host must call --version (or initialize) before allowing the component to serve."
        },
        "versionCheckStrategy": {
          "type": "string",
          "enum": ["version-flag", "version-flag-json", "lsp-initialize"],
          "default": "version-flag"
        },
        "required": {
          "type": "boolean",
          "default": true,
          "description": "If true, failure to resolve + verify blocks activation."
        },
        "asset": {
          "type": "object",
          "description": "Only for kind=asset. Non-executable payload.",
          "additionalProperties": false,
          "properties": {
            "source": { "type": "string" },
            "target": { "type": "string" },
            "bundle": { "type": "boolean" },
            "contentHash": { "type": "boolean" },
            "requireHashes": {
              "type": "boolean",
              "default": true,
              "description": "SWR-SEC-FROZEN-INSTALL: when the asset has a pip/url source, the bundler MUST install it with --require-hashes against a pinned hash (a tampered/yanked upstream artifact then aborts the build instead of shipping in the VSIX)."
            },
            "downloadOnFirstUse": { "type": "boolean" }
          }
        }
      },
      "allOf": [
        {
          "if": { "properties": { "kind": { "const": "asset" } }, "required": ["kind"] },
          "then": { "required": ["asset"] }
        },
        {
          "if": {
            "properties": { "kind": { "enum": ["cli", "lsp", "mcp", "sidecar", "dap", "tool"] } },
            "required": ["kind"]
          },
          "then": { "required": ["binaryName", "expectedVersion", "sources"] }
        }
      ]
    },
    "hostPolicy": {
      "type": "object",
      "additionalProperties": false,
      "properties": {
        "artifact": {
          "type": "string",
          "enum": [
            "vsix-per-platform",
            "vsix-fat",
            "intellij-jar",
            "zed-wasm",
            "archive",
            "brew-formula",
            "scoop-manifest",
            "nuget",
            "pub"
          ]
        },
        "activationVerifies": {
          "type": "array",
          "description": "Component ids whose version the host must verify at activation.",
          "items": { "type": "string" }
        },
        "onMismatch": {
          "type": "string",
          "enum": ["error", "warn", "prompt-reinstall", "prompt-pkgmgr"],
          "default": "error"
        }
      }
    }
  }
}
