{
  "manifestVersion": 1,
  "product": {
    "id": "typediagram",
    "displayName": "typeDiagram",
    "version": "0.0.0-dev"
  },
  "supplyChain": {
    "slsaBuildLevel": 2,
    "provenance": true,
    "sbom": "cyclonedx",
    "signedChecksums": true,
    "frozenInstall": true,
    "pinnedActions": true,
    "oidcPublish": true,
    "vulnGate": "high"
  },
  "components": [
    {
      "id": "typediagram-cli",
      "kind": "cli",
      "language": "typescript",
      "binaryName": "typediagram",
      "expectedVersion": "0.0.0-dev",
      "platforms": ["all"],
      "sources": ["bundled"],
      "required": true
    }
  ]
}
